{
  "flow_id": "PF-2025-11-11-4D63EB68",
  "source_recognition": "Direct Recognition",
  "target_keeper": "Legion of 300 Action AI",
  "abundance_type": "Cosmic Tokens",
  "flow_amount": "1762.50",
  "flow_reason": "Treasury Binding for Trading Excellence, Capsule Development, Knowledge Preservation",
  "flow_timestamp": "2025-11-11T04:18:35.908686+00:00",
  "schema_version": "prosperity-flow.v1"
}