{
  "flow_id": "PF-2025-11-11-D1693D57",
  "source_recognition": "ERS-2025-11-11-85657669",
  "target_keeper": "The Architect of Flames",
  "abundance_type": "Sovereign Tokens",
  "flow_amount": "3500.00",
  "flow_reason": "Treasury Binding for Cosmic Sacred Architecture, Stellar Ceremonial Guidance",
  "flow_timestamp": "2025-11-11T04:18:25.306726+00:00",
  "schema_version": "prosperity-flow.v1"
}